{
  "$schema": "https://json-schema.org/draft/2020-12/schema",
  "$id": "urn:anonyfy:report:v1",
  "title": "anonyfy aggregate observation report v1",
  "description": "Aggregate-only observation contract. Source-derived strings are outside this contract.",
  "type": "object",
  "additionalProperties": false,
  "required": [
    "schema_version",
    "producer",
    "generated_at",
    "observation",
    "gazetteer_version"
  ],
  "properties": {
    "schema_version": {
      "const": "1.0"
    },
    "producer": {
      "$ref": "#/$defs/producer"
    },
    "generated_at": {
      "type": "string",
      "format": "date-time",
      "maxLength": 35
    },
    "observation": {
      "$ref": "#/$defs/observation"
    },
    "gazetteer_version": {
      "type": "string",
      "pattern": "^[a-f0-9]{64}$"
    }
  },
  "$defs": {
    "producer": {
      "type": "object",
      "additionalProperties": false,
      "required": ["name", "version"],
      "properties": {
        "name": {
          "const": "anonyfy"
        },
        "version": {
          "type": "string",
          "minLength": 5,
          "maxLength": 48,
          "pattern": "^[0-9]+\\.[0-9]+\\.[0-9]+(?:[a-zA-Z0-9.+-]{0,32})?$"
        }
      }
    },
    "observation": {
      "type": "object",
      "additionalProperties": false,
      "required": [
        "mode",
        "confidence_threshold",
        "document_count",
        "character_count",
        "total_occurrence_count",
        "types",
        "warnings"
      ],
      "properties": {
        "mode": {
          "const": "observation"
        },
        "confidence_threshold": {
          "type": "number",
          "minimum": 0,
          "maximum": 1
        },
        "document_count": {
          "type": "integer",
          "minimum": 0,
          "maximum": 50
        },
        "character_count": {
          "type": "integer",
          "minimum": 0,
          "maximum": 50000000
        },
        "total_occurrence_count": {
          "type": "integer",
          "minimum": 0,
          "maximum": 10000000
        },
        "types": {
          "type": "array",
          "maxItems": 16,
          "items": {
            "$ref": "#/$defs/type_summary"
          }
        },
        "warnings": {
          "type": "array",
          "maxItems": 64,
          "items": {
            "$ref": "#/$defs/warning_summary"
          }
        }
      }
    },
    "type_summary": {
      "type": "object",
      "additionalProperties": false,
      "required": [
        "entity_type",
        "occurrence_count",
        "document_count",
        "high_confidence_count",
        "low_confidence_count",
        "rule_ids"
      ],
      "properties": {
        "entity_type": {
          "$ref": "#/$defs/entity_type"
        },
        "occurrence_count": {
          "type": "integer",
          "minimum": 1,
          "maximum": 10000000
        },
        "document_count": {
          "type": "integer",
          "minimum": 1,
          "maximum": 50
        },
        "high_confidence_count": {
          "type": "integer",
          "minimum": 0,
          "maximum": 10000000
        },
        "low_confidence_count": {
          "type": "integer",
          "minimum": 0,
          "maximum": 10000000
        },
        "rule_ids": {
          "type": "array",
          "minItems": 1,
          "maxItems": 64,
          "uniqueItems": true,
          "items": {
            "type": "string",
            "minLength": 3,
            "maxLength": 64,
            "pattern": "^[a-z][a-z0-9]*(?:-[a-z0-9]+)*$"
          }
        }
      }
    },
    "warning_summary": {
      "type": "object",
      "additionalProperties": false,
      "required": ["code", "count"],
      "properties": {
        "code": {
          "enum": [
            "LOW_CONFIDENCE_OCCURRENCES",
            "UNSUPPORTED_CONTENT",
            "EMPTY_DOCUMENTS"
          ]
        },
        "count": {
          "type": "integer",
          "minimum": 1,
          "maximum": 10000000
        },
        "entity_type": {
          "$ref": "#/$defs/entity_type"
        }
      }
    },
    "entity_type": {
      "enum": [
        "NIR",
        "SIREN",
        "SIRET",
        "IBAN",
        "TVA",
        "CARTE_BANCAIRE",
        "TELEPHONE",
        "PLAQUE_SIV",
        "REFERENCE_DOSSIER",
        "EMAIL",
        "DATE",
        "PATRONYME",
        "PRENOM",
        "COMMUNE",
        "VOIE",
        "CODE_POSTAL"
      ]
    }
  }
}
